Story Heading,Story Excerpt,Timestamp,Section
Pakistan,No compromise on independence of judiciary: CJP,Says this year has been most challenging due to coronavirus pandemic.,"15 Sep, 2020 09:12am"
Newspaper,Fast and furious Farooq Hamid says dirty politics plague Pakistan cricket,Former pacer severely criticises PCB’s decision of abolishing departmental cricket.,"27 Sep, 2020 11:08am"
Newspaper,FICTION: HEARTS AND MINDS,A bi-cultural novel about two Egyptian sisters set in the post-Arab Spring world explores timeless issues of love and longing...,"13 Sep, 2020 07:20am"
Pakistan,Footprints: Travelling to the north during Covid-19,Travel poses many ethical and philosophical approaches to the pandemic.,"06 Sep, 2020 08:43am"
Pakistan,"Fresh Rs7bn reference filed against Shahbaz, sons",PM aide says 177 suspicious transactions detected; money laundered through staff of family’s firms.,"24 Sep, 2020 10:57am"
Pakistan,"Two suspects arrested for allegedly assaulting, shooting 15-year-old boy","The victim was shot for putting up resistance to the suspects' attempt to rape him, says father.","01 Sep, 2020 05:00pm"
Newspaper,Back to school in the pandemic,"This week, many of you went back to school and colleges, physically, while many stayed at home and continued with...","19 Sep, 2020 07:05am"
World,"Spin hero Rashid Khan pays tribute to late mother, his 'biggest fan'",Khan made his debut for Afghanistan in 2015 and has emerged as a key figure in the nation's rise as a cricketing force.,"30 Sep, 2020 03:52pm"
Newspaper,Misbah regrets not winning Test series and T20s in England,"“Our mistakes are quite visible and our inexperienced bowling was exposed when it was attacked.""","08 Sep, 2020 10:51am"
Pakistan,Death by a thousand cuts,"The user can disappear and then reappear days, weeks or even months later, totally cleansed of ideology or conscience or sense of","13 Sep, 2020 06:51am"
Newspaper,Clearance of Afghanistan-bound cargo up 54pc,"Pakistan’s closure of borders with Afghanistan had led to the piling up of over 12,500 containers at port and border stations.","26 Sep, 2020 09:33am"
Pakistan,Murad seeks matching funds from centre for 24 Karachi projects,Says the appointment of the KMC administrator is the provincial govt's prerogative.,"04 Sep, 2020 10:01am"
World,"Impunity is growing, Hindutva’s appeal is waning in today's India",Friends condole with friends with great concern that India has gone fascist.,"15 Sep, 2020 08:41am"
Pakistan,Govt in negotiation with IPPs over pricing: Qureshi,"Providing electricity, gas, education and health facilities to the masses is the govt's top priority, the foreign minister says.","07 Sep, 2020 10:30am"
Pakistan,Sindh delays resumption of classes for secondary students by a week over virus fears,Classes scheduled to resume on Sept 21 will now begin on Sept 28 if the coronavirus situation improves: minister.,"18 Sep, 2020 10:05pm"
World,Academy sets inclusion guidelines to promote diversity at the Oscars,"New rules lay out percentages of actors, staff to be occupied by people of colour, with a disability or from the LGBTQ community","09 Sep, 2020 05:16pm"
World,Saudi King tells Trump that kingdom is eager to achieve fair solution to Palestinian issue,King Salman says Saudi Arabia wants permanent solution based on the Arab Peace Initiative proposed by the kingdom in 2002.,"07 Sep, 2020 11:49am"
Pakistan,IATA’s safety audit team arrives today,"Experts will visit country’s main airports, conduct an audit of PIA’s various departments.","05 Sep, 2020 08:30am"
Pakistan,President reaffirms centre’s support for Karachi,"Alvi meets business leaders and industrialists of Karachi, acknowledges their role in the national economy.","10 Sep, 2020 11:30am"
Pakistan,"Relatives protest as body of minor boy, killed after suspected rape, found in Karachi",The child's body was recovered from a man who was carrying it in a cloth bag; police have arrested him.,"25 Sep, 2020 06:54pm"
Pakistan,Aviation division told to file 2016 ATR crash report by Oct 15,Court directs Election Commission of Pakistan to conduct the local government elections in Sindh within 120 days.,"09 Sep, 2020 10:48am"
Newspaper,Fighting poverty without data,Relevant statistics on inequality have not been updated since 2015-16.,"14 Sep, 2020 10:16am"
Pakistan,"Several schools, colleges in Sindh sealed for SOPs’ violation","""When it comes to children, we will not tolerate any negligence,"" says Sindh Education Minister Saeed Ghani.","18 Sep, 2020 10:45am"
Pakistan,WHO fears resurgence of Covid-19 after reopening of schools,Officials say they have issued an advisory to the govt regarding school related public health measures.,"24 Sep, 2020 10:59am"
World,Batman production halted after Robert Pattinson tests positive for coronavirus,Filming had resumed north of London only three days ago after being shut down in mid-March,"04 Sep, 2020 11:33am"
Pakistan,WHO chief lauds Pakistan for suppressing Covid-19 while keeping economy afloat,"""The choice is not between controlling the virus or saving the economy; the two go hand-in-hand,"" writes Tedros Ghebreyesus.","30 Sep, 2020 12:38pm"
Newspaper,Pakistan takes part in Russian drills ceremony,"Representatives from Azerbaijan, Indonesia, Iran, Kazakhstan, Tajikistan and Sri Lanka are participating as observers.","20 Sep, 2020 09:03am"
World,Post Malone leads Billboard Awards nominations with 16 nods,"Lil Nas X follows Malone with 13 nominations, while Billie Eilish and Khalid each scored 12 nods.","23 Sep, 2020 02:24pm"
Pakistan,SHC orders formation of JIT in rights  activist’s ‘enforced disappearance’ case,Mohib Azad Leghari — an advocate by profession — was taken away by police and some persons in civvies in Hyderabad on Sept 4.,"23 Sep, 2020 10:31am"
Newspaper,Greece building new shelter for homeless migrants,"Some 11,500 asylum seekers, including 2,200 women and 4,000 children, are without adequate shelter, says UN refugee agency.","12 Sep, 2020 08:58am"
Pakistan,63pc of environmental samples in Punjab test positive for poliovirus,Official report says ratio was 38pc last year.,"20 Sep, 2020 11:29am"
Newspaper,Old power plants to be phased out,"Various units of about 1,400MW will be closed down immediately followed by another 1,500MW of units by the year 2022.","11 Sep, 2020 09:42am"
Pakistan,PM rejects criticism of dual nationals holding public office,"Overseas Pakistanis are our biggest asset; the best minds, professionals and entrepreneurs are outside the country, he says.","11 Sep, 2020 11:51am"
Pakistan,3 cases of attempted rape against minors registered in the last 24 hours in Faisalabad,Victims include a nine-year-old boy and girls aged four and 15.,"13 Sep, 2020 10:46pm"
World,"Depression rate in the US triples during pandemic, study finds","People with lower incomes, women and single people at greater risk of experiencing depression symptoms: survey.","10 Sep, 2020 04:37pm"
Pakistan,Motorway gang-rape case still shrouded in darkness,News reports about 2 men being picked up for using the victim's ATM card have turned out to be false.,"12 Sep, 2020 08:25am"
Pakistan,Celebrities demand change following Lahore motorway gang rape,"Further adding fuel to the fire were the vile comments from the Lahore CCPO, a man in authority blaming the victim without remorse","11 Sep, 2020 06:21pm"
Pakistan,FIR lodged against 30 lawyers for allegedly torturing an on-duty constable in Wazirabad,Victim says lawyers snatched his rifle and started beating and verbally abusing him. His uniform was torn as well.,"06 Sep, 2020 06:09pm"
Pakistan,PIA unveils special flight operation for people intending to attend Arbaeen in Iraq,"Passengers can travel from Karachi, Lahore and Islamabad.","16 Sep, 2020 09:32am"
Pakistan,Two teenaged girls shot in their home over 'matrimonial dispute' in village near Dadu: police,One of the victims died on the spot while the other is in critical condition.,"27 Sep, 2020 06:49pm"
Newspaper,US remains top buyer of Pakistani goods,"UK is second biggest buyer, followed by Germany and China.","29 Sep, 2020 10:11am"
Pakistan,Alyani fears increase in Covid-19 cases,Directs the Balochistan Command and Operations Centre to monitor the spread of the virus in the province.,"23 Sep, 2020 09:24am"
Pakistan,Farooq Sattar acquitted in Pakistan Quarters rioting case,Judge says the prosecution had failed to prove the allegations against the accused persons.,"16 Sep, 2020 10:44am"
World,Apple to open its first online store in India next week,"The online store, which will open for business on September 23, will offer ""a range of affordability options"", the company says.","18 Sep, 2020 12:41pm"
Pakistan,Another polio case surfaces in Bahawalpur in a month,Officials say an inquiry will be launched to determine if the child was given polio drops regularly.,"26 Sep, 2020 10:50am"
Newspaper,Govt estimates IPP talks could save Rs856bn over next decade,Cabinet Committee on Energy reviews report for negotiations with independent power producers.,"25 Sep, 2020 09:31am"
Newspaper,Bio-secure bubbles a blueprint for others: Morgan,"“I think we’ve pioneered and mapped out exactly how to get cricket back on,"" he says.","18 Sep, 2020 11:22am"
Newspaper,The weekly weird,Driver’s license bears photo of empty chair!,"19 Sep, 2020 07:05am"
Pakistan,"IIA’s construction cost being probed, senators told",Civil Aviation Secretary Hassan Nasir Jamy says inquiries are being carried out regarding packages worth Rs81bn.,"24 Sep, 2020 10:50am"
Pakistan,Provinces’ help to be sought in polio drive: PM aide,Dr Faisal rules out a polio-free Pakistan without parents’ continued support.,"03 Sep, 2020 10:38am"
Pakistan,CAA amends SOPs for flights till Oct 31,Social distancing among passengers made non-compulsory.,"03 Sep, 2020 09:16am"
Newspaper,Johnson accuses EU of plotting food blockade on UK,German minister says failure to clinch a deal will have serious consequences for Britain.,"13 Sep, 2020 08:48am"
Newspaper,Autos see mixed trend in August,"Cumulative sales in the first two months of the current fiscal year increased to 20,008 units.","11 Sep, 2020 09:43am"
Pakistan,Second phase of Ehsaas cash assistance package soon,"Rs175 billion has been disbursed under the package to 14.6 million beneficiaries, says Dr Sania Nishtar.","04 Sep, 2020 08:43am"
Newspaper,Paris cleaver attack suspect says wanted to target Charlie Hebdo,The Pakistan-born teenager says he wanted to avenge republication of cartoons of Prophet Muhammad (PBUH) by the satirical weekly.,"27 Sep, 2020 11:59am"
Newspaper,I endured racist abuse from Yorkshire fans: Rana Naved,"Yorkshire says allegations are ‘very concerning’, pledges to investigate the issue.","17 Sep, 2020 10:33am"
Sp Supplements,The spillover effect of feudal mindset,"Like the losers adopt the traits of the victors, society at large seems to have adopted the attitude of the landed gentry.","12 Sep, 2020 03:39pm"
World,"Investigators launch over 150 probes in French horse mutilations, killings spate","Across France, horses have been found with ears cut off, eyes gouged out and genitals mutilated for reasons unknown.","10 Sep, 2020 07:50am"
Newspaper,‘No need for Liverpool panic after Community Shield loss to Arsenal’,"“During the whole game we played well, dominated, pressed them well and created many chances,"" says Virgil van Dijk.","01 Sep, 2020 11:12am"
Pakistan,Adnan Siddiqui plays the flute to honour Pakistan Air Force,"""As a tribute to these magnanimous superheroes on Youm-e-Fizaya, a very small gesture from me.""","08 Sep, 2020 10:51am"
Pakistan,NAB told to file supplementary reference in Saaf Pani case,"PML-N’s former MPA Raja Qamarul Islam, PAS senior officer among prime suspects.","02 Sep, 2020 10:51am"
Newspaper,Spotlight,"Wonder Women of History, the new DC graphic novel","19 Sep, 2020 07:05am"
Newspaper,"Story Time: Cheerful, colourful and clean",She was so sad. She kept thinking about the world...,"13 Sep, 2020 06:58am"
Pakistan,Coalition For Women In Journalism demands justice for murdered female journalist Shaheena Shaheen,"In its statement condemning the murder, the CFWIJ says that Shaheena’s culprit must not be spared at any cost.","10 Sep, 2020 09:45am"
Pakistan,"In harm's way: To save lives, Pakistani doctors risk their own every day",Incidents of violence and hostile behaviour at hospitals are tolerated and even brushed aside as part and parcel of the job.,"14 Sep, 2020 11:29am"
Pakistan,"Country being diverted to sectarian crisis, says Fazl","“Imran Khan will be the direct beneficiary of sectarian and linguistic rifts,” he says.","08 Sep, 2020 09:25am"
Newspaper,"World economy to shrink 3.8pc in 2020, says IIF",Report says China and India account for almost all of the weaker global growth picture.,"12 Sep, 2020 09:30am"
Pakistan,Govt deliberately keeping HR bodies dysfunctional: Senate body,"Ministries of human rights and law division directed to address issue related to non-functioning of NCHR, NCRC within two weeks.","29 Sep, 2020 10:46am"
World,Pakistan among countries to run Phase 3 trials of two Chinese firms' Covid-19 vaccines,"CNBG’s Phase 3 trials are expected to involve 50,000 people in about 10 countries, says company official.","05 Sep, 2020 07:57pm"
Pakistan,"Migration, mosquitos and mismanagement — more than a million Mirpurkhas residents struggle after monsoon rains","“Often, these villagers must make a choice — whether to protect their livestock or their children,” laments a resident.","10 Sep, 2020 07:33pm"
Pakistan,SHC verdict declaring sugar commission illegal temporarily suspended by Supreme Court,"SC says commission didn't include experts, attorney general argues it was not supposed to mete out punishment.","02 Sep, 2020 10:51pm"
World,Dogs used to detect coronavirus in pilot project at Helsinki airport,"Research shows the dogs will find the disease five days before patients get any clinical symptoms, says researcher.","24 Sep, 2020 10:00pm"
Newspaper,"Suarez language exam for Italian citizenship rigged, say prosecutors","University denies any wrongdoing, says it acted with ""correctness and transparency"".","23 Sep, 2020 11:33am"
Newspaper,No plot change but new stars as Premier League kicks off,Leeds United are back in the top flight after a 16-year absence.,"12 Sep, 2020 11:07am"
World,Ellen DeGeneres' talk show will return for season 18 amid controversy,"After backlash surrounding a hostile work environment and producers involved in sexual misconduct, the show returns on Sept 21.","09 Sep, 2020 10:47am"
Pakistan,MoU signed to operate electric buses in capital,"In first phase, 30 buses will be operated on different routes, says minister.","16 Sep, 2020 10:46am"
Newspaper,Flat week on PSX,Major selling was witnessed in commercial banks at $2.41m and food and personal care products $2.32m.,"20 Sep, 2020 09:53am"
Sp Supplements,Into the future via the past,There is enough evidence in history to believe that Pakistan will continue to move forward.,"12 Sep, 2020 03:56pm"
Pakistan,Sharmeen Obaid-Chinoy roped in to co-direct Marvel's first Muslim superhero,"Chinoy will join Meera Menon, Adil El Arbi and Bilall Fallah in bringing the Disney+'s Ms Marvel series to life","19 Sep, 2020 02:46pm"
Newspaper,Govt allows rise in prices of 94 life-saving drugs,"The prices of these drugs had not been increased for a decade causing a shortage in the market, says SAPM Dr Faisal Sultan.","23 Sep, 2020 08:16am"
Pakistan,Shoaib Dastgir removed as Punjab IG following reports of refusal to work with new Lahore CCPO,"AIG refuses to work under newly-appointed IGP Inam Ghani, citing ""seniority"".","09 Sep, 2020 08:20am"
Pakistan,Notification about shifting Quetta’s tax collection suspended,Court orders that notices be issued to the attorney general and advocate general for Balochistan.,"07 Sep, 2020 09:15am"
Pakistan,Protest held against cancellation of advertised jobs,"Protesters chant slogans against the provincial government, blaming it for limiting employment opportunities in the province.","21 Sep, 2020 09:22am"
Pakistan,SHC restrains police from taking action against residents named in FIR lodged on CBC's complaint,"The order will remain effective until the next court hearing, which will be held on September 24.","09 Sep, 2020 06:33pm"
Newspaper,Cement ‘cartel’ inquiry proceeds,The CCP has noted that the production capacity of the sector has increased from 44m tonnes in 2014 to 69m tonnes in 2020.,"25 Sep, 2020 09:42am"
World,Meghan loses privacy lawsuit against leaked biography details,The Duchess is suing publisher over articles on revealing parts of the handwritten letter she sent to her estranged father in 2018,"30 Sep, 2020 01:23pm"
,13 more educational institutions closed in past 24 hours for failing to follow SOPs,"According to NCOC, 10 educational institutions have been shut down in KP, 3 in Sindh.","18 Sep, 2020 08:51pm"
Pakistan,Any organisation urging Pakistan to solve the matter of enforced disappearances is acting as a friend,"Unfortunately, Islamabad’s attitude towards both the ICJ and HRW is characterised by crass opportunism.","17 Sep, 2020 08:39am"
Pakistan,Usman Mukhtar's Bench makes it to Cannes Independent Film Festival,"""We're all really grateful and immensely glad to have made it this far,"" reveals the Anaa star.","04 Sep, 2020 03:16pm"
Newspaper,Tauqir appeals to PM not to abolish departmental hockey,Also advises the PHF to use money in a better way and to make heavy investments at the grassroots level.,"06 Sep, 2020 12:14pm"
Pakistan,"Notices issued to JPMC dept, others over delay in surgeries",SHC directs additional advocate general to call a senior official from the orthopaedic dept at the next hearing.,"29 Sep, 2020 10:52am"
Pakistan,"IHC disposes of Nawaz’s appeal against order in Al-Azizia case, for now",Says plea to be taken up after matters pertaining to his attendance in court are dealt with.,"17 Sep, 2020 09:33am"
World,One Direction wax statues removed from Madam Tussauds,"The museum previously employed a Tissue Assistant by the statues, for crying fans.","11 Sep, 2020 12:16pm"
Newspaper,PCB to spend Rs15 million  on Covid-19 testing during domestic season,"Each player will undergo tests, at least twice in the lead-up to the tournaments.","15 Sep, 2020 11:12am"
Newspaper,Aspas double stuns Valencia,Valencia have not won away from home in the league since December.,"21 Sep, 2020 11:01am"
World,"For Lebanese, recovery too heavy to bear a month after blast",Aid groups worry funds are not robust enough to secure and repair shelter.,"06 Sep, 2020 02:54pm"
Pakistan,IHC concerned at rise in missing persons’ cases,Justice Kayani reminds federal government it is responsible for protecting the life and dignity of citizens.,"15 Sep, 2020 08:17am"
Pakistan,"YDA enraged at termination of doctor over abusing, threatening fellow female professional","YDA Punjab's president demands cyber crime wing to probe matter, says no one ""will be allowed to steal a person's livelihood"".","18 Sep, 2020 09:36pm"
Pakistan,"Won't use skin smoothing filters and promote insecurity, says Asim Azhar","When a user commented he should've used a filter, the singer shared that he doesn't want his young fans to have low self-worth","10 Sep, 2020 01:21pm"
Pakistan,Minister condemns Hindutva regime’s tactics to damage Kashmiri culture,Afridi says artists can contribute to efforts for highlighting Kashmir issue.,"06 Sep, 2020 09:26am"
Newspaper,Wonder Craft: Point a score,Playing target games is always exciting and there are a number of such games.,"19 Sep, 2020 07:05am"
Pakistan,Balochistan Diary-II: Banking on twin strategies,Govts have to pursue economic and social development coupled with political  outreach to those presently outside the system.,"17 Sep, 2020 09:21am"
Pakistan,Another child from Balochistan contracts poliovirus,The number of polio cases in Balochistan has risen to 18 this year.,"08 Sep, 2020 08:42am"
Pakistan,Iran deports hundreds of illegal Pakistani migrants,All the deportees are being handed over to the Federal Investigation Agency for further interrogation.,"12 Sep, 2020 09:16am"
Newspaper,Ishrat stresses tax reforms to cut high deficits,"""If the country does not improve higher fiscal deficit and needed borrowing, it would increase reliance on IMF,"" explains adviser.","03 Sep, 2020 10:10am"
Pakistan,Much-delayed opposition moot now slated for 20th,The decision to hold the MPC was announced by Rehbar Committee’s convener and senior JUI-F leader Akram Durrani.,"04 Sep, 2020 08:40am"
Newspaper,The weekly weird,Horror show to ‘unwind’ from pandemic stress,"26 Sep, 2020 07:00am"
Newspaper,Mailbox,Is the lockdown really finished?,"05 Sep, 2020 07:08am"
Pakistan,Seven teachers test positive for Covid-19 in KP,The infected teachers and their students have been quarantined.,"25 Sep, 2020 11:13am"
World,Walking Dead will be laid to rest in 2022,The end is coming but so are spin-offs.,"10 Sep, 2020 02:58pm"
Pakistan,Fewer Covid-19 cases reported in Rawalpindi,The virus has claimed the lives of 347 people in the division.,"07 Sep, 2020 10:47am"
Pakistan,No clue to Upper Dir boy missing for 50 days,Eight-year-old's uncle says the whole family was going through trauma and waiting for his safe return.,"22 Sep, 2020 11:18am"
Newspaper,Exports plunge 20pc in August,"Rains and consequential urban flooding caused significant problems, affecting exports for August, says Abdul Razak Dawood.","04 Sep, 2020 09:08am"
Newspaper,Unheralded Garcia dumps top seed Pliskova out of US Open,Pliskova says her defeat has nothing to do with being elevated to the top of the draw after a host of high-ranking withdrawals.,"04 Sep, 2020 10:57am"
Pakistan,Shahbaz to visit Karachi tomorrow in solidarity with rain affectees,"""During the visit, he will visit Edhi Foundation and meet those affected by the devastating rains,"" says PML-N's Ahsan Iqbal","01 Sep, 2020 11:01am"
Pakistan,"Karachi, the city that lives in fear",Politics has robbed Karachiites of fun and frolic.,"02 Sep, 2020 10:37am"
Business,Tech talk: A platform to integrate B2B softwares,"There has been a recalibration towards SaaS companies which are increasingly seen as a bastion of stability, healthy financials.","13 Sep, 2020 10:18am"
Pakistan,"Paintings capture Lahore’s social fabric, diminishing heritage",The online show depicts self-taught artist Kamal Hyat's pain about fading cultural and architectural heritage.,"03 Sep, 2020 11:18am"
Newspaper,"US orders ban on TikTok, blocks use of WeChat","TikTok denounces order, says it will continue to fight the Trump administration's crackdown.","19 Sep, 2020 09:54am"
Newspaper,PM tells UN India is planning misadventure,"Says Pakistan is ready to ""fight for its freedom to the end"".","26 Sep, 2020 08:09am"
Newspaper,"Trump says he wanted to kill Assad, but Mattis opposed idea",Trump was reportedly mulling assassinating Assad after the Syrian president launched a chemical attack on civilians in April 2017.,"16 Sep, 2020 03:23pm"
Pakistan,IHC wants ‘missing’ govt official recovered by tomorrow,Capital police constitute two special investigation teams to trace whereabouts of the missing SECP official.,"06 Sep, 2020 08:14am"
Newspaper,Pakistan needs to fine-tune fishery policies: experts,FAO technical experts give detailed presentations on the outline draft policy for fisheries and aquaculture.,"26 Sep, 2020 09:40am"
Pakistan,Senate body wants telemetry system for fair water distribution,Directs authorities concerned to submit PC-1 of the telemetry system within 15 days.,"26 Sep, 2020 08:50am"
World,US Supreme Court Justice Ruth Bader Ginsburg dies at 87,"Hundreds of tearful mourners laid flowers in front of the US Supreme Court, where the diminutive Ginsburg sat for 27 years.","19 Sep, 2020 03:34pm"
Pakistan,IHC stays interior ministry order asking US blogger to leave Pakistan,"In her petition, Ritchie said interior ministry itself told the court she was not involved in ""anti-state and illegal activity"".","07 Sep, 2020 12:39pm"
World,Netflix does not agree with Chinese author's racist views on Uighur Muslims,"Liu Cixin is the consulting producer of The Three Body Problem, being turned into a series led by the creators of Game of thrones","28 Sep, 2020 03:30pm"
Pakistan,JI fears ‘national disaster’ if Karachi not given rights,"Sirajul Haq vows to turn the JI drive into a nationwide movement, plans solidarity day on Oct 14.","28 Sep, 2020 10:59am"
Pakistan,"Transgender person shot dead, another injured in Peshawar attack","Police say motive behind shooting is unclear, investigation underway.","09 Sep, 2020 03:00pm"
Pakistan,"Shehbaz visits rain-hit Karachi with PML-N leaders; call on Bilawal, Zardari",Both PPP and PML-N will attend the Rehbar Committee meeting tomorrow where dates for the multi-party conference will be announced.,"02 Sep, 2020 10:11pm"
Newspaper,Hamilton grabs Russian GP pole,The six-time champion clocked a best lap in one minute and 31.304 seconds to outpace Max Verstappen of Red Bull by half a second.,"27 Sep, 2020 11:29am"
Newspaper,World Bank tribunal issues stay in Reko Diq case,"""This is a success for Pakistan and its legal team,"" says a statement issued by the Attorney General office.","18 Sep, 2020 08:07am"
Pakistan,"Zardari, Faryal Talpur indicted in money laundering case","""Political victimisation of the opposition continues during a global pandemic,"" says Bilawal.","28 Sep, 2020 04:22pm"
Pakistan,Killer of blasphemy accused to be tried under juvenile law,PHC CJ Waqar Ahmad Seth also ordered to transfer the suspect’s case from ATC-III to another at his request.,"26 Sep, 2020 10:59am"
Newspaper,Resurgence of virus stirs wake-up call in Europe,"“Although numbers reflect more comprehensive testing, they also show alarming rates of transmission across the region.""","18 Sep, 2020 09:49am"
